{
  "$schema": "https://json-schema.org/draft/2020-12/schema",
  "$id": "https://synapse.local/contracts/events/executar-codigo.schema.json",
  "title": "executar-codigo",
  "description": "Comando enviado pelo codegen ao Worker para executar o código gerado em container efêmero isolado. É comando, e não evento, porque o codegen pausa o grafo aguardando o resultado. O dataset não viaja: está embutido na imagem do sandbox.",
  "type": "object",
  "required": [
    "job_id",
    "codigo_gerado_id",
    "competencias"
  ],
  "properties": {
    "job_id": {
      "type": "string",
      "format": "uuid",
      "description": "Identificador do job ao qual a execução pertence. Chave de correlação; o Worker não tem permissão em jobs."
    },
    "codigo_gerado_id": {
      "type": "string",
      "format": "uuid",
      "description": "Linha de codigos_gerados que contém o código Python a executar. O código viaja por referência, nunca no corpo da mensagem."
    },
    "competencias": {
      "type": "array",
      "minItems": 1,
      "items": {
        "$ref": "../domain/comum.schema.json#/$defs/competencia"
      },
      "description": "Competências que o sandbox deve processar, vindas de jobs.competencias. São processadas numa execução só, e os totais apurados são do período inteiro; a contribuição de cada mês sai na quebra por competência da decomposição.",
      "examples": [
        [
          "2025-08",
          "2025-11"
        ]
      ]
    },
    "orcamento": {
      "allOf": [
        {
          "$ref": "../domain/comum.schema.json#/$defs/brl"
        }
      ],
      "minimum": 0,
      "description": "Critério de orçamento do período, vindo de jobs.orcamento. Viaja como escalar porque o Worker não tem permissão em jobs, e é gravado junto do resultado para que o insumo do veredito não possa mudar depois. Ausente quando o job não tem orçamento: a simulação é feita sem a verificação de orçamento, totais.orcamento fica ausente e o resultado de sucesso sai sem veredito. Um comando sem orçamento só é publicado depois de o Worker aceitá-lo (T-281)."
    },
    "meta_venda": {
      "allOf": [
        {
          "$ref": "../domain/comum.schema.json#/$defs/brl"
        }
      ],
      "exclusiveMinimum": 0,
      "description": "Meta de venda do período: o total de vendas das competências do job sobre o qual a regra é simulada. Na simulação do job, vem de jobs.meta_venda; na execução candidata da busca da meta maior, é a meta candidata. Com ela, o sandbox multiplica o vlr_venda de todas as vendas das competências por um fator único, meta_venda / total histórico de vendas do período, preservando a proporção entre lojas, marcas, cargos e pessoas, e reapura o baseline sobre as vendas escaladas antes de chamar o código gerado (contracts/harness/README.md, seção \"O payload do container\"). Diferente do orçamento, a meta não julga o resultado: muda a entrada da apuração, e por isso entra no container. Ausente, a simulação usa as vendas históricas, como antes do campo existir.",
      "examples": [
        12000000.0
      ]
    },
    "proposito": {
      "type": "string",
      "enum": [
        "simulacao",
        "busca_meta"
      ],
      "description": "Para que serve a execução. simulacao é a simulação do job, o valor quando o campo falta. busca_meta é a execução candidata da busca da meta maior: o mesmo codigo_gerado_id simulado numa meta candidata, sem chamar a LLM, que não é desfecho do job. O Worker não muda a execução por causa dele: grava o valor em resultados_simulacao.proposito e o devolve em simulacao-concluida, para a API não tratar a candidata como resultado do job."
    },
    "elementos_exigidos": {
      "type": "array",
      "minItems": 1,
      "uniqueItems": true,
      "items": {
        "$ref": "../domain/comum.schema.json#/$defs/elemento_ref"
      },
      "description": "Elementos da regra que o código gerado precisa declarar como implementados, para o Worker conferir a cobertura fora do container: nucleo.percentual, quando o núcleo tem percentual, e o ref de cada item de especificacoes. Os demais campos do núcleo (vigencia, loja, marca, cargo) recortam o alcance da regra e não entram. O Worker confere que todo elemento desta lista está em elementos_implementados, no retorno de aplicar_regra, e que toda contribuição é atribuída a um elemento desta lista (contracts/harness/README.md, seção \"Conferência de cobertura\"); a falha é erro_codigo com causa cobertura_incompleta. Ausente, o Worker não faz a conferência, e a execução segue como antes do campo existir.",
      "examples": [
        [
          "nucleo.percentual",
          "elem.1"
        ]
      ]
    },
    "alcance": {
      "type": "object",
      "description": "As linhas a que a regra dá efeito, já calculadas pelo codegen a partir da representação: fora delas, a comissão simulada de cada matrícula e competência tem de ser a do baseline. O Worker confere isso fora do container, depois da cobertura, linha a linha do detalhamento, com tolerância de um centavo; a falha é erro_codigo com causa fora_do_escopo (contracts/harness/README.md, seção \"Conferência de escopo\"). Cada chave ausente não restringe a dimensão, e uma linha está no alcance quando atende a todas as presentes e não está entre as excluídas. O alcance, como o orçamento, nunca entra no container. Ausente, o Worker não faz a conferência, e a execução segue como antes do campo existir.",
      "properties": {
        "vigencia": {
          "$ref": "../domain/comum.schema.json#/$defs/vigencia",
          "description": "Competências em que a regra vale. A competência do job fora dela é simulada pelas regras do baseline."
        },
        "loja": {
          "type": "array",
          "minItems": 1,
          "uniqueItems": true,
          "items": { "$ref": "../domain/comum.schema.json#/$defs/codigo" },
          "description": "Lojas da regra, comparadas ao cod_loja de cada linha do detalhamento."
        },
        "marca": {
          "type": "array",
          "minItems": 1,
          "uniqueItems": true,
          "items": { "$ref": "../domain/comum.schema.json#/$defs/codigo" },
          "description": "Marcas da regra, comparadas ao cod_marca de cada linha do detalhamento."
        },
        "cargo": {
          "type": "array",
          "minItems": 1,
          "uniqueItems": true,
          "items": { "$ref": "../domain/comum.schema.json#/$defs/codigo" },
          "description": "Cargos a que a regra dá efeito, comparados ao cod_cargo de cada linha. Sem taxa uniforme, são só os cargos com taxa própria em taxas_por_cargo: o cargo sem taxa conserva o baseline."
        },
        "excluidos": {
          "type": "object",
          "description": "Códigos que um elemento exclusao retira da regra inteira, por dimensão.",
          "properties": {
            "loja": { "type": "array", "minItems": 1, "items": { "$ref": "../domain/comum.schema.json#/$defs/codigo" } },
            "marca": { "type": "array", "minItems": 1, "items": { "$ref": "../domain/comum.schema.json#/$defs/codigo" } },
            "cargo": { "type": "array", "minItems": 1, "items": { "$ref": "../domain/comum.schema.json#/$defs/codigo" } }
          }
        }
      },
      "examples": [
        {
          "vigencia": { "inicio": "2025-08", "fim": "2025-11" },
          "loja": ["13", "58"],
          "marca": ["10", "20"],
          "cargo": ["100", "150", "200"]
        }
      ]
    }
  },
  "examples": [
    {
      "job_id": "3f2b1c40-0d18-4a51-9f2e-6c1d9a77b021",
      "codigo_gerado_id": "5d4c3b2a-1f0e-4d9c-8b7a-6e5d4c3b2a19",
      "competencias": [
        "2025-08",
        "2025-11"
      ],
      "orcamento": 485000.0,
      "elementos_exigidos": [
        "nucleo.percentual",
        "elem.1"
      ],
      "alcance": {
        "vigencia": {
          "inicio": "2025-08",
          "fim": "2025-11"
        },
        "loja": [
          "13"
        ]
      }
    },
    {
      "job_id": "3f2b1c40-0d18-4a51-9f2e-6c1d9a77b021",
      "codigo_gerado_id": "5d4c3b2a-1f0e-4d9c-8b7a-6e5d4c3b2a19",
      "competencias": [
        "2025-08",
        "2025-11"
      ],
      "orcamento": 485000.0
    }
  ]
}
