{
  "job_id": "3f2b1c40-0d18-4a51-9f2e-6c1d9a77b021",
  "codigo_gerado_id": "5d4c3b2a-1f0e-4d9c-8b7a-6e5d4c3b2a19",
  "competencias": ["2025-08", "2025-09", "2025-11"],
  "orcamento": 1200000.0,
  "meta_venda": 30000000.0,
  "elementos_exigidos": ["nucleo.taxas_por_cargo", "elem.1"],
  "alcance": {
    "loja": ["13", "58"],
    "marca": ["10", "20"],
    "cargo": ["100", "150", "200"]
  }
}
